ffffa07e8ca01900 3356022732 S Co:1:017:0 s 40 00 0000 0001 0000 0
ffffa07e8ca01900 3356022777 C Co:1:017:0 0 0
ffffa07e8ca01900 3356022821 S Co:1:017:0 s 40 03 04e2 0201 0000 0
ffffa07e8ca01900 3356022859 C Co:1:017:0 0 0
ffffa07e8ca01900 3356022869 S Co:1:017:0 s 40 03 c068 0201 0000 0
ffffa07e8ca01900 3356022893 C Co:1:017:0 0 0
ffffa07e8ca01900 3356022918 S Ci:1:017:0 s 80 06 0300 0000 0004 4 <
ffffa07e8ca01900 3356022963 C Ci:1:017:0 0 4 = 04030904
ffffa07e8ca01900 3356022973 S Ci:1:017:0 s 80 06 0302 0409 00ff 255 <
ffffa07e8ca01900 3356023052 C Ci:1:017:0 0 32 = 20035300 69006e00 67006c00 65002000 52005300 32003300 32002d00 48005300
ffffa07e8ca01900 3356023063 S Ci:1:017:0 s 80 06 0300 0000 0004 4 <
ffffa07e8ca01900 3356023153 C Ci:1:017:0 0 4 = 04030904
ffffa07e8ca01900 3356023179 S Ci:1:017:0 s 80 06 0301 0409 00ff 255 <
ffffa07e8ca01900 3356023306 C Ci:1:017:0 0 10 = 0a034600 54004400 4900
ffffa07e8ca01900 3356023369 S Co:1:017:0 s 40 00 0000 0001 0000 0
ffffa07e8ca01900 3356023406 C Co:1:017:0 0 0
ffffa07e8ca01900 3356023415 S Co:1:017:0 s 40 0b 0000 0001 0000 0
ffffa07e8ca01900 3356023462 C Co:1:017:0 0 0
ffffa07e8ca01900 3356023470 S Co:1:017:0 s 40 00 0001 0001 0000 0
ffffa07e8ca01900 3356023499 C Co:1:017:0 0 0
ffffa07e8ca01900 3356023508 S Co:1:017:0 s 40 00 0002 0001 0000 0
ffffa07e8ca01900 3356023535 C Co:1:017:0 0 0
ffffa07e8ca01900 3356023558 S Co:1:017:0 s 40 09 0005 0001 0000 0
ffffa07e8ca01900 3356023591 C Co:1:017:0 0 0
ffffa07e8ca01900 3356023616 S Co:1:017:0 s 40 0b 02fb 0001 0000 0
ffffa07e8ca01900 3356023633 C Co:1:017:0 0 0
ffffa07e8ca01900 3356023643 S Bi:1:017:1 -115 4096 <
ffffa07e8ca01900 3356023689 C Bi:1:017:1 0 2 = 3260
ffffa07e8ca01900 3356023724 S Bo:1:017:2 -115 4 = 8a860400
ffffa07e8ca01900 3356023738 C Bo:1:017:2 0 4 >
ffffa07e8ca01900 3356023747 S Bi:1:017:1 -115 4096 <
ffffa07e8ca01900 3356027775 C Bi:1:017:1 0 2 = 3260
ffffa07e8ca01900 3356027830 S Co:1:017:0 s 40 00 0001 0001 0000 0
ffffa07e8ca01900 3356027902 C Co:1:017:0 0 0
ffffa07e8ca01900 3356027941 S Co:1:017:0 s 40 00 0002 0001 0000 0
ffffa07e8ca01900 3356027970 C Co:1:017:0 0 0
ffffa07e8ca01900 3356028072 S Bo:1:017:2 -115 6 = 80080b82 080b
ffffa07e8ca01900 3356028088 C Bo:1:017:2 0 6 >
ffffa07e8ca01900 3356028161 S Bo:1:017:2 -115 14 = 4b05ff4b 03823903 00ffffff ff87
ffffa07e8ca01900 3356028199 C Bo:1:017:2 0 14 >
ffffa07e8ca01900 3356028259 S Bi:1:017:1 -115 512 <
ffffa07e8ca01900 3356028274 C Bi:1:017:1 0 6 = 3260790a 2100
ffffa07e8ca01900 3356028350 S Bo:1:017:2 -115 8 = 390300ff ffffff87
ffffa07e8ca01900 3356028374 C Bo:1:017:2 0 8 >
ffffa07e8ca01900 3356028403 S Bi:1:017:1 -115 512 <
ffffa07e8ca01900 3356028417 C Bi:1:017:1 0 6 = 3260ffff ffff
ffffa07e8ca01900 3356028426 S Bo:1:017:2 -115 3 = 4b04bf
ffffa07e8ca01900 3356028460 C Bo:1:017:2 0 3 >
ffffa07e8ca01900 3356028510 S Bo:1:017:2 -115 17 = 80ff0082 ff008439 0400aa55 00ffaa85 87
ffffa07e8ca01900 3356028527 C Bo:1:017:2 0 17 >
ffffa07e8ca01900 3356028536 S Bi:1:017:1 -115 512 <
ffffa07e8ca01900 3356028569 C Bi:1:017:1 0 7 = 3260aa55 00ffaa
ffffa07e8ca01900 3356028578 S Co:1:017:0 s 40 0b 0000 0001 0000 0
ffffa07e8ca01900 3356028609 C Co:1:017:0 0 0
ffffa07e936c6000 3356028625 S Co:1:017:0 s 40 00 0000 0001 0000 0
ffffa07e936c6000 3356028648 C Co:1:017:0 0 0
ffffa07e936c6000 3356028657 S Co:1:017:0 s 40 00 0002 0001 0000 0
ffffa07e936c6000 3356028688 C Co:1:017:0 0 0
ffffa07e936c6000 3356028695 S Co:1:017:0 s 40 00 0001 0001 0000 0
ffffa07e936c6000 3356028729 C Co:1:017:0 0 0
